A1: Charlene Calendar | I1: Today's Date: | K1: =TODAY() -> 39482
B2: Item | C2: Sub-Item | D2: Start | E2: Duration | F2: End | G2: Lead Time | H2: Owner | I2: Due Date | J2: Status | K2: Notes
B3: CH @ Seattle | D3: 39417 | E3: 0 | F3: =D3+E3 -> 39417 | G3: =MAX(G4:G7) -> 90 | I3: =F3-G3 -> 39327 | J3: OK
C4: Booking | D4: 39417 | E4: 0 | F4: =D4+E4 -> 39417 | G4: 90 | H4: JM | I4: =F4-G4 -> 39327 | J4: OK | K4: all set!
C5: Posters | D5: 39417 | E5: 0 | F5: =D5+E5 -> 39417 | G5: 30 | H5: MM | I5: =F5-G5 -> 39387 | J5: OK
C6: Promotion | D6: 39417 | E6: 0 | F6: =D6+E6 -> 39417 | G6: 30 | H6: JM | I6: =F6-G6 -> 39387 | J6: OK
C7: Ship Gear | D7: 39417 | E7: 0 | F7: =D7+E7 -> 39417 | G7: 15 | H7: RR / MM | I7: =F7-G7 -> 39402 | J7: OK
B9: Recording? | D9: 39424 | E9: 8 | F9: =D9+E9 -> 39432 | G9: =MAX(G10:G11) -> 7 | I9: =F9-G9 -> 39425 | K9: Track "Stadium", "Arena", etc?
C10: Basic Tracking | D10: 39424 | E10: 2 | F10: =D10+E10 -> 39426 | G10: 7 | I10: =F10-G10 -> 39419
C11: Overdubs, etc | D11: 39431 | E11: 2 | F11: =D11+E11 -> 39433 | G11: 7 | I11: =F11-G11 -> 39426
B13: Single #1 | D13: 39553 | E13: 0 | F13: =D13+E13 -> 39553 | G13: =MAX(G14:G19) -> 62 | I13: =F13-G13 -> 39491
C14: Mastering | D14: 39553 | E14: 0 | F14: =D14+E14 -> 39553 | G14: 62 | I14: =F14-G14 -> 39491
C15: Tunecore Submission | D15: 39553 | E15: 0 | F15: =D15+E15 -> 39553 | G15: 56 | H15: MM | I15: =F15-G15 -> 39497
C16: Download Site | D16: 39553 | E16: 0 | F16: =D16+E16 -> 39553 | G16: 28 | H16: MM | I16: =F16-G16 -> 39525
C17: Artwork | D17: 39553 | E17: 0 | F17: =D17+E17 -> 39553 | G17: 28 | H17: MM | I17: =F17-G17 -> 39525 | J17: OK
C18: Band Photos | D18: 39553 | E18: 0 | F18: =D18+E18 -> 39553 | G18: 21 | H18: MM | I18: =F18-G18 -> 39532
C19: Download Cards / CDs | D19: 39553 | E19: 0 | F19: =D19+E19 -> 39553 | G19: 21 | H19: MM | I19: =F19-G19 -> 39532 | J19: OK
B21: Merch | D21: 39549 | E21: 0 | F21: =D21+E21 -> 39549 | G21: =MAX(G22:G25) -> 30 | I21: =F21-G21 -> 39519
C22: Refresh CDs & 7ins | D22: 39548 | E22: 0 | F22: =D22+E22 -> 39548 | G22: 5 | I22: =F22-G22 -> 39543 | K22: Check merch case. If necessary, make more CDs & 7ins.
C23: T-Shirts | D23: 39548 | E23: 0 | F23: =D23+E23 -> 39548 | G23: 30 | H23: MM | I23: =F23-G23 -> 39518
C24: Buttons | D24: 39548 | E24: 0 | F24: =D24+E24 -> 39548 | G24: 30 | H24: MM | I24: =F24-G24 -> 39518
C25: Stickers | D25: 39548 | E25: 0 | F25: =D25+E25 -> 39548 | G25: 30 | H25: MM | I25: =F25-G25 -> 39518
B27: Tour #1 | D27: 39584 | E27: 9 | F27: =D27+E27 -> 39593 | G27: =MAX(G28:G30) -> 90 | I27: =F27-G27 -> 39503
C28: Booking | D28: 39584 | E28: 0 | F28: =D28+E28 -> 39584 | G28: 90 | I28: =F28-G28 -> 39494 | K28: where to? which cities?
C29: Posters | D29: 39584 | E29: 0 | F29: =D29+E29 -> 39584 | G29: 30 | H29: MM | I29: =F29-G29 -> 39554
C30: Promotion | D30: 39584 | E30: 0 | F30: =D30+E30 -> 39584 | G30: 30 | H30: MM | I30: =F30-G30 -> 39554 | K30: press, radio, etc for each tour stop
B32: Album | D32: 39609 | E32: 0 | F32: =D32+E32 -> 39609 | G32: =MAX(G33:G37) -> 63 | I32: =F32-G32 -> 39546
C33: Mastering | D33: 39609 | E33: 0 | F33: =D33+E33 -> 39609 | G33: 63 | I33: =F33-G33 -> 39546
C34: Artwork | D34: 39609 | E34: 0 | F34: =D34+E34 -> 39609 | G34: 28 | H34: MM | I34: =F34-G34 -> 39581
C35: Download Cards | D35: 39609 | E35: 0 | F35: =D35+E35 -> 39609 | G35: 21 | H35: MM | I35: =F35-G35 -> 39588
C36: Download Site | D36: 39609 | E36: 0 | F36: =D36+E36 -> 39609 | G36: 56 | H36: MM | I36: =F36-G36 -> 39553
C37: Tunecore Submission | D37: 39609 | E37: 0 | F37: =D37+E37 -> 39609 | G37: 56 | H37: MM | I37: =F37-G37 -> 39553
B39: Tour #2 | D39: 39696 | E39: 9 | F39: =D39+E39 -> 39705 | G39: =MAX(G40:G42) -> 90 | I39: =F39-G39 -> 39615
C40: Booking | D40: 39610 | E40: 0 | F40: =D40+E40 -> 39610 | G40: 90 | I40: =F40-G40 -> 39520
C41: Posters | D41: 39610 | E41: 0 | F41: =D41+E41 -> 39610 | G41: 30 | H41: MM | I41: =F41-G41 -> 39580
C42: Promotion | D42: 39610 | E42: 0 | F42: =D42+E42 -> 39610 | G42: 30 | H42: MM | I42: =F42-G42 -> 39580